{
  "format": "figmasync",
  "version": 1,
  "generator": {
    "name": "widgetify-figma",
    "version": "0.1.0"
  },
  "exportedAt": "2026-10-13T12:00:00.000Z",
  "source": {
    "fileName": "Sovereign Call UI",
    "pageName": "Menus",
    "frameId": "38:1",
    "frameName": "MainMenu"
  },
  "options": {
    "scale": 2,
    "includeHidden": true,
    "rasterizeUnsupported": true,
    "variantPrefixes": [
      "Btn/",
      "Button/"
    ]
  },
  "root": {
    "id": "38:1",
    "name": "MainMenu",
    "cleanName": "MainMenu",
    "tags": {},
    "type": "FRAME",
    "visible": true,
    "opacity": 1,
    "rotation": 0,
    "x": 0,
    "y": 0,
    "width": 1920,
    "height": 1080,
    "clipsContent": true,
    "style": {
      "fills": [
        {
          "type": "SOLID",
          "visible": true,
          "opacity": 1,
          "blendMode": "NORMAL",
          "color": {
            "r": 0.0431,
            "g": 0.0588,
            "b": 0.0902,
            "a": 1
          }
        }
      ],
      "strokes": [],
      "strokeWeight": 1,
      "strokeAlign": "INSIDE",
      "dashed": false,
      "cornerRadius": [
        0,
        0,
        0,
        0
      ],
      "cornerSmoothing": 0,
      "effects": [],
      "blendMode": "PASS_THROUGH",
      "simple": true
    },
    "children": [
      {
        "id": "10:1",
        "name": "[img 1x] Bg_Gradient",
        "cleanName": "Bg_Gradient",
        "tags": {
          "img": "",
          "scale": "1"
        },
        "type": "RECTANGLE",
        "visible": true,
        "opacity": 1,
        "rotation": 0,
        "x": 0,
        "y": 0,
        "width": 1920,
        "height": 1080,
        "constraints": {
          "horizontal": "STRETCH",
          "vertical": "STRETCH"
        },
        "style": {
          "fills": [
            {
              "type": "GRADIENT_LINEAR",
              "visible": true,
              "opacity": 1,
              "blendMode": "NORMAL",
              "stops": [
                {
                  "position": 0,
                  "color": {
                    "r": 0.1059,
                    "g": 0.1451,
                    "b": 0.2118,
                    "a": 1
                  }
                },
                {
                  "position": 1,
                  "color": {
                    "r": 0.0196,
                    "g": 0.0275,
                    "b": 0.0431,
                    "a": 1
                  }
                }
              ]
            }
          ],
          "strokes": [],
          "strokeWeight": 1,
          "strokeAlign": "INSIDE",
          "dashed": false,
          "cornerRadius": [
            0,
            0,
            0,
            0
          ],
          "cornerSmoothing": 0,
          "effects": [],
          "blendMode": "PASS_THROUGH",
          "simple": false
        },
        "image": {
          "asset": "img1",
          "bounds": {
            "x": 0,
            "y": 0,
            "width": 1920,
            "height": 1080
          },
          "reason": "tag"
        }
      },
      {
        "id": "11:1",
        "name": "Img_Glow",
        "cleanName": "Img_Glow",
        "tags": {},
        "type": "ELLIPSE",
        "visible": true,
        "opacity": 1,
        "rotation": 0,
        "x": 760,
        "y": 40,
        "width": 400,
        "height": 400,
        "constraints": {
          "horizontal": "CENTER",
          "vertical": "MIN"
        },
        "style": {
          "fills": [
            {
              "type": "GRADIENT_LINEAR",
              "visible": true,
              "opacity": 1,
              "blendMode": "NORMAL",
              "stops": [
                {
                  "position": 0,
                  "color": {
                    "r": 0.9098,
                    "g": 0.7608,
                    "b": 0.4784,
                    "a": 1
                  }
                },
                {
                  "position": 1,
                  "color": {
                    "r": 0,
                    "g": 0,
                    "b": 0,
                    "a": 1
                  }
                }
              ]
            }
          ],
          "strokes": [],
          "strokeWeight": 1,
          "strokeAlign": "INSIDE",
          "dashed": false,
          "cornerRadius": [
            0,
            0,
            0,
            0
          ],
          "cornerSmoothing": 0,
          "effects": [],
          "blendMode": "PASS_THROUGH",
          "simple": false
        },
        "image": {
          "asset": "img2",
          "bounds": {
            "x": 0,
            "y": 0,
            "width": 400,
            "height": 400
          },
          "reason": "gradient"
        }
      },
      {
        "id": "14:1",
        "name": "[img 3x] Logo",
        "cleanName": "Logo",
        "tags": {
          "img": "",
          "scale": "3"
        },
        "type": "GROUP",
        "visible": true,
        "opacity": 1,
        "rotation": 0,
        "x": 885,
        "y": 96,
        "width": 150,
        "height": 150,
        "constraints": {
          "horizontal": "MIN",
          "vertical": "MIN"
        },
        "style": {
          "fills": [],
          "strokes": [],
          "strokeWeight": 1,
          "strokeAlign": "INSIDE",
          "dashed": false,
          "cornerRadius": [
            0,
            0,
            0,
            0
          ],
          "cornerSmoothing": 0,
          "effects": [],
          "blendMode": "PASS_THROUGH",
          "simple": true
        },
        "image": {
          "asset": "img3",
          "bounds": {
            "x": 0,
            "y": 0,
            "width": 150,
            "height": 150
          },
          "reason": "tag"
        }
      },
      {
        "id": "15:1",
        "name": "Txt_Title",
        "cleanName": "Txt_Title",
        "tags": {},
        "type": "TEXT",
        "visible": true,
        "opacity": 1,
        "rotation": 0,
        "x": 650,
        "y": 262,
        "width": 620,
        "height": 86,
        "constraints": {
          "horizontal": "CENTER",
          "vertical": "MIN"
        },
        "text": {
          "characters": "Sovereign Call",
          "fontFamily": "Cinzel",
          "fontStyle": "Bold",
          "fontWeight": 700,
          "italic": false,
          "fontSize": 64,
          "color": {
            "r": 0.9098,
            "g": 0.7608,
            "b": 0.4784,
            "a": 1
          },
          "alignH": "CENTER",
          "alignV": "TOP",
          "autoResize": "WIDTH_AND_HEIGHT",
          "truncate": false,
          "maxLines": 0,
          "letterSpacing": {
            "value": 8,
            "unit": "PERCENT"
          },
          "lineHeight": {
            "value": 0,
            "unit": "AUTO"
          },
          "textCase": "UPPER",
          "decoration": "NONE",
          "mixed": false,
          "shadow": {
            "color": {
              "r": 0,
              "g": 0,
              "b": 0,
              "a": 0.6
            },
            "offset": {
              "x": 0,
              "y": 4
            },
            "radius": 12
          }
        }
      },
      {
        "id": "16:1",
        "name": "Img_Divider",
        "cleanName": "Img_Divider",
        "tags": {},
        "type": "LINE",
        "visible": true,
        "opacity": 1,
        "rotation": 0,
        "x": 760,
        "y": 372,
        "width": 400,
        "height": 0,
        "constraints": {
          "horizontal": "CENTER",
          "vertical": "MIN"
        },
        "style": {
          "fills": [],
          "strokes": [
            {
              "type": "SOLID",
              "visible": true,
              "opacity": 0.5,
              "blendMode": "NORMAL",
              "color": {
                "r": 0.9098,
                "g": 0.7608,
                "b": 0.4784,
                "a": 1
              }
            }
          ],
          "strokeWeight": 2,
          "strokeAlign": "INSIDE",
          "dashed": false,
          "cornerRadius": [
            0,
            0,
            0,
            0
          ],
          "cornerSmoothing": 0,
          "effects": [],
          "blendMode": "PASS_THROUGH",
          "simple": true
        }
      },
      {
        "id": "21:1",
        "name": "Pnl_Menu",
        "cleanName": "Pnl_Menu",
        "tags": {},
        "type": "FRAME",
        "visible": true,
        "opacity": 1,
        "rotation": 0,
        "x": 760,
        "y": 420,
        "width": 400,
        "height": 368,
        "constraints": {
          "horizontal": "CENTER",
          "vertical": "CENTER"
        },
        "clipsContent": true,
        "style": {
          "fills": [
            {
              "type": "SOLID",
              "visible": true,
              "opacity": 0.92,
              "blendMode": "NORMAL",
              "color": {
                "r": 0.0706,
                "g": 0.0941,
                "b": 0.149,
                "a": 1
              }
            }
          ],
          "strokes": [
            {
              "type": "SOLID",
              "visible": true,
              "opacity": 0.45,
              "blendMode": "NORMAL",
              "color": {
                "r": 0.9098,
                "g": 0.7608,
                "b": 0.4784,
                "a": 1
              }
            }
          ],
          "strokeWeight": 1,
          "strokeAlign": "INSIDE",
          "dashed": false,
          "cornerRadius": [
            16,
            16,
            16,
            16
          ],
          "cornerSmoothing": 0,
          "effects": [
            {
              "type": "DROP_SHADOW",
              "visible": true,
              "radius": 24,
              "color": {
                "r": 0,
                "g": 0,
                "b": 0,
                "a": 0.55